{
  "$schema": "../schemas/inventory-export.schema.json",
  "schema_version": 1,
  "generated_at": "2026-07-21T13:21:13Z",
  "default_registry": "self",
  "counts": {
    "registries": 1,
    "skills": 4,
    "installable_skills": 4,
    "released_skills": 4
  },
  "registries": [
    {
      "name": "self",
      "kind": "git",
      "priority": 100,
      "enabled": true,
      "trust": "private",
      "resolver_candidate": true,
      "federation_mode": null,
      "allowed_publishers": [],
      "publisher_map": {},
      "require_immutable_artifacts": false,
      "resolved_root": ".",
      "resolved_ref": "refs/heads/main",
      "resolved_commit": null,
      "resolved_tag": null,
      "resolved_origin_url": "https://github.com/EudOnline/infinitas-skill.git"
    }
  ],
  "skills": [
    {
      "name": "consume-infinitas-skill",
      "publisher": "lvxiaoer",
      "qualified_name": "lvxiaoer/consume-infinitas-skill",
      "identity_mode": "qualified",
      "version": "0.1.1",
      "status": "active",
      "summary": "Guide agents through search, recommendation, inspection, pull, install, and upgrade flows for released infinitas-skill artifacts.",
      "path": "skills/active/consume-infinitas-skill",
      "installable": true,
      "released": true,
      "source_registry": "self",
      "source_registry_url": "https://github.com/EudOnline/infinitas-skill.git",
      "source_registry_trust": "private",
      "source_registry_ref": "refs/heads/main",
      "source_registry_commit": null,
      "source_registry_tag": null,
      "source_update_mode": "local-only",
      "source_pin_mode": "branch",
      "source_pin_value": "main",
      "source_federation_mode": null,
      "resolver_candidate": true,
      "distribution_manifest_path": "catalog/distributions/lvxiaoer/consume-infinitas-skill/0.1.1/manifest.json",
      "distribution_bundle_path": "catalog/distributions/lvxiaoer/consume-infinitas-skill/0.1.1/skill.tar.gz",
      "release_attestation_path": "catalog/provenance/consume-infinitas-skill-0.1.1.json",
      "release_attestation_signature_path": "catalog/provenance/consume-infinitas-skill-0.1.1.json.ssig",
      "release_source_snapshot_tag": "skill/consume-infinitas-skill/v0.1.1",
      "release_source_snapshot_commit": "e98fb0f1386dee3f9f3e8ab0cf56a38b9612475b",
      "release_file_manifest_count": 8,
      "release_build_archive_format": "tar.gz",
      "release_installed_integrity_capability": "supported",
      "release_installed_integrity_reason": null
    },
    {
      "name": "federation-registry-ops",
      "publisher": "lvxiaoer",
      "qualified_name": "lvxiaoer/federation-registry-ops",
      "identity_mode": "qualified",
      "version": "0.1.1",
      "status": "active",
      "summary": "Help agents inspect registry sources, federation rules, mirror behavior, and audit or inventory exports inside infinitas-skill.",
      "path": "skills/active/federation-registry-ops",
      "installable": true,
      "released": true,
      "source_registry": "self",
      "source_registry_url": "https://github.com/EudOnline/infinitas-skill.git",
      "source_registry_trust": "private",
      "source_registry_ref": "refs/heads/main",
      "source_registry_commit": null,
      "source_registry_tag": null,
      "source_update_mode": "local-only",
      "source_pin_mode": "branch",
      "source_pin_value": "main",
      "source_federation_mode": null,
      "resolver_candidate": true,
      "distribution_manifest_path": "catalog/distributions/lvxiaoer/federation-registry-ops/0.1.1/manifest.json",
      "distribution_bundle_path": "catalog/distributions/lvxiaoer/federation-registry-ops/0.1.1/skill.tar.gz",
      "release_attestation_path": "catalog/provenance/federation-registry-ops-0.1.1.json",
      "release_attestation_signature_path": "catalog/provenance/federation-registry-ops-0.1.1.json.ssig",
      "release_source_snapshot_tag": "skill/federation-registry-ops/v0.1.1",
      "release_source_snapshot_commit": "e98fb0f1386dee3f9f3e8ab0cf56a38b9612475b",
      "release_file_manifest_count": 8,
      "release_build_archive_format": "tar.gz",
      "release_installed_integrity_capability": "supported",
      "release_installed_integrity_reason": null
    },
    {
      "name": "operate-infinitas-skill",
      "publisher": "lvxiaoer",
      "qualified_name": "lvxiaoer/operate-infinitas-skill",
      "identity_mode": "qualified",
      "version": "0.1.2",
      "status": "active",
      "summary": "Teach OpenClaw, Codex, and Claude Code how to operate inside the infinitas-skill repository.",
      "path": "skills/active/operate-infinitas-skill",
      "installable": true,
      "released": true,
      "source_registry": "self",
      "source_registry_url": "https://github.com/EudOnline/infinitas-skill.git",
      "source_registry_trust": "private",
      "source_registry_ref": "refs/heads/main",
      "source_registry_commit": null,
      "source_registry_tag": null,
      "source_update_mode": "local-only",
      "source_pin_mode": "branch",
      "source_pin_value": "main",
      "source_federation_mode": null,
      "resolver_candidate": true,
      "distribution_manifest_path": "catalog/distributions/lvxiaoer/operate-infinitas-skill/0.1.2/manifest.json",
      "distribution_bundle_path": "catalog/distributions/lvxiaoer/operate-infinitas-skill/0.1.2/skill.tar.gz",
      "release_attestation_path": "catalog/provenance/operate-infinitas-skill-0.1.2.json",
      "release_attestation_signature_path": "catalog/provenance/operate-infinitas-skill-0.1.2.json.ssig",
      "release_source_snapshot_tag": "skill/operate-infinitas-skill/v0.1.2",
      "release_source_snapshot_commit": "e98fb0f1386dee3f9f3e8ab0cf56a38b9612475b",
      "release_file_manifest_count": 8,
      "release_build_archive_format": "tar.gz",
      "release_installed_integrity_capability": "supported",
      "release_installed_integrity_reason": null
    },
    {
      "name": "release-infinitas-skill",
      "publisher": "lvxiaoer",
      "qualified_name": "lvxiaoer/release-infinitas-skill",
      "identity_mode": "qualified",
      "version": "0.1.1",
      "status": "active",
      "summary": "Guide agents through validation, review, promotion, and immutable release of infinitas-skill registry skills.",
      "path": "skills/active/release-infinitas-skill",
      "installable": true,
      "released": true,
      "source_registry": "self",
      "source_registry_url": "https://github.com/EudOnline/infinitas-skill.git",
      "source_registry_trust": "private",
      "source_registry_ref": "refs/heads/main",
      "source_registry_commit": null,
      "source_registry_tag": null,
      "source_update_mode": "local-only",
      "source_pin_mode": "branch",
      "source_pin_value": "main",
      "source_federation_mode": null,
      "resolver_candidate": true,
      "distribution_manifest_path": "catalog/distributions/lvxiaoer/release-infinitas-skill/0.1.1/manifest.json",
      "distribution_bundle_path": "catalog/distributions/lvxiaoer/release-infinitas-skill/0.1.1/skill.tar.gz",
      "release_attestation_path": "catalog/provenance/release-infinitas-skill-0.1.1.json",
      "release_attestation_signature_path": "catalog/provenance/release-infinitas-skill-0.1.1.json.ssig",
      "release_source_snapshot_tag": "skill/release-infinitas-skill/v0.1.1",
      "release_source_snapshot_commit": "e98fb0f1386dee3f9f3e8ab0cf56a38b9612475b",
      "release_file_manifest_count": 8,
      "release_build_archive_format": "tar.gz",
      "release_installed_integrity_capability": "supported",
      "release_installed_integrity_reason": null
    }
  ]
}
